{
  "$schema": "../schemas/vendor.schema.json",
  "version": 1,
  "name": "llama-vulkan-reference",
  "description": "Exact llama.cpp source revision used by the Qwen campaign Vulkan baseline",
  "checkouts": [
    {
      "name": "llama",
      "repository": "https://github.com/ggml-org/llama.cpp.git",
      "revision": "b95502ba9aa0eb73a2f4fc8878d7fbe6a847a0b9",
      "upstream": "https://github.com/ggml-org/llama.cpp/commit/b95502ba9aa0eb73a2f4fc8878d7fbe6a847a0b9",
      "path": "../vendor/llama.cpp-vulkan-reference",
      "patches": []
    }
  ],
  "artifacts": [
    {
      "name": "source",
      "path": "${checkout.llama}",
      "kind": "directory"
    }
  ]
}
